query,datetime,response,source
Why is my lettuce wilted although I water regularly?,2024-10-30T09:02:37.170484,"*Disclaimer: The following response may not be accurate as your question was not found in the verified database.*

Wilted lettuce, despite regular watering, can be due to several factors:

1. Overwatering: Even though lettuce needs a consistent supply of water, too much water can cause the roots to become waterlogged and oxygen-starved, leading to wilted leaves. Be sure to provide enough drainage and not let the plants sit in water.

2. Heat and sunlight: Lettuce prefers cool weather and can wilt or bolt (a fast, vertical growth often followed by flowering) quickly in high heat or under too much direct sun. Providing shade during the hottest part of the day may help.

3. Disease or pests: Certain plant diseases or pests could be affecting the plant's health. Fungal diseases are known for wilting plants even with adequate watering. Check for signs of infection or infestation.

4. Poor soil: If your soil quality is poor, the lettuce may have a hard time absorbing water and nutrients, resulting in wilted leaves. Use compost or other organic matter to enrich your soil.

5. Transplant shock: If you've recently moved your lettuce to a new location, it might suffer from transplant shock, causing it to wilt.

If none of these possibilities seem to apply, it would be a good idea to check with a local nursery or extension service, as they might be aware of specific local conditions or problems that could be affecting your lettuce plants.",self_generate
