query,datetime,response,source
How to deal with termite?,2024-11-05T01:22:31.323097,"*Disclaimer: The following response may not be accurate as your question was not found in the verified database.*

Dealing with termites especially in a gardening context can be quite challenging. Here's a step-by-step guide to address termite infestations:

1. Identify Termite Variety: Recognize the type of termite you are dealing with as different types require different treatment methods. Subterranean termites require soil treatment, but drywood termites, often found in plants, may require fumigation.

2. Inspection: Regularly inspect your garden for signs of termites including, damaged wood, mud tubes, and discarded wings.

3. Remove Infected Plants: If you notice a plant or tree has been infested by termites, you might need to remove and dispose of it to prevent the termites from spreading throughout the garden.

4. Use Natural Predators: Beneficial insects like spiders, beetles, and ants are natural predators of termites. Birds are also great termite predators, so attracting birds to your garden could help.

5. Use Termite Treatment Solutions: This can include termite sprays, foams, and bait stations that are specifically designed to kill termites. Always follow the manufacturer’s instructions when using these products.

6. Get Professional Help: If the termite infestation is severe, it might be more effective to call a professional pest control service. They have specialized tools and knowledge to handle large infestations.

7. Prevention: Maintaining your garden regularly can help stop termite infestations before they occur. This includes keeping your garden clean and free of dead wood or plant debris, avoiding excessive mulch near home structures, and ensuring good drainage to avoid damp soil which attracts termites.

Remember, when dealing with chemicals or severe infestations, it's best to contact a professional to ensure the safety and health of your garden.",self_generate
How to deal with termite?,2024-11-05T01:30:06.380881,"*Disclaimer: The following response may not be accurate as your question was not found in the verified database.*

Dealing with termites in the context of plants and gardening involves a few steps:

1. **Identify the Problem:** The first step is to confirm termite infestation. Termites are small, pale soft-bodied insects that live in large colonies and primarily feed on dead plant material, often in the form of wood, leaf litter, soil, and animal dung. Signs of infite infestation include small holes in the wood, mounds of soil near wood surfaces, and piles of frass, termite droppings.

2. **Eliminate Moisture:** Termites are attracted to moisture. So, remove any leakage in your garden, damp wood sources, and do proper drainage of water.

3. **Use Termite-Killing Products:** Use products specifically designed to kill termites. These can be in the form of bait stations, which can be planted around the perimeter of the home or garden and continuously kill termites over a period of time. You can also use termite killer sprays on affected areas.

4. **Keep Wood Away From Soil:** Try to keep wood materials, including wooden stems or branches of plants away from the soil. This will help to reduce the termites' feeding sources.

5. **Regular Inspection:** Regularly inspect your garden and your home for signs of termite infestation. The most effective way to prevent and control termites is early detection.

6. **Professional Help:** If the infestation becomes large or difficult to handle, you may need to enlist the help of a professional pest control service. They have the tools and knowledge to deal with termite infestations effectively.

Remember that it's best to prevent termite infestations in the first place by keeping your garden clean and free of excess wood debris and regularly inspecting for signs of termites. If you catch the problem early, it can be much easier to deal with.",self_generate
