query,datetime,response,source
How to deal with termite?,2024-11-05T01:22:31.323097,"*Disclaimer: The following response may not be accurate as your question was not found in the verified database.*

Dealing with termites especially in a gardening context can be quite challenging. Here's a step-by-step guide to address termite infestations:

1. Identify Termite Variety: Recognize the type of termite you are dealing with as different types require different treatment methods. Subterranean termites require soil treatment, but drywood termites, often found in plants, may require fumigation.

2. Inspection: Regularly inspect your garden for signs of termites including, damaged wood, mud tubes, and discarded wings.

3. Remove Infected Plants: If you notice a plant or tree has been infested by termites, you might need to remove and dispose of it to prevent the termites from spreading throughout the garden.

4. Use Natural Predators: Beneficial insects like spiders, beetles, and ants are natural predators of termites. Birds are also great termite predators, so attracting birds to your garden could help.

5. Use Termite Treatment Solutions: This can include termite sprays, foams, and bait stations that are specifically designed to kill termites. Always follow the manufacturer’s instructions when using these products.

6. Get Professional Help: If the termite infestation is severe, it might be more effective to call a professional pest control service. They have specialized tools and knowledge to handle large infestations.

7. Prevention: Maintaining your garden regularly can help stop termite infestations before they occur. This includes keeping your garden clean and free of dead wood or plant debris, avoiding excessive mulch near home structures, and ensuring good drainage to avoid damp soil which attracts termites.

Remember, when dealing with chemicals or severe infestations, it's best to contact a professional to ensure the safety and health of your garden.",self_generate
How to deal with termite?,2024-11-05T01:30:06.380881,"*Disclaimer: The following response may not be accurate as your question was not found in the verified database.*

Dealing with termites in the context of plants and gardening involves a few steps:

1. **Identify the Problem:** The first step is to confirm termite infestation. Termites are small, pale soft-bodied insects that live in large colonies and primarily feed on dead plant material, often in the form of wood, leaf litter, soil, and animal dung. Signs of infite infestation include small holes in the wood, mounds of soil near wood surfaces, and piles of frass, termite droppings.

2. **Eliminate Moisture:** Termites are attracted to moisture. So, remove any leakage in your garden, damp wood sources, and do proper drainage of water.

3. **Use Termite-Killing Products:** Use products specifically designed to kill termites. These can be in the form of bait stations, which can be planted around the perimeter of the home or garden and continuously kill termites over a period of time. You can also use termite killer sprays on affected areas.

4. **Keep Wood Away From Soil:** Try to keep wood materials, including wooden stems or branches of plants away from the soil. This will help to reduce the termites' feeding sources.

5. **Regular Inspection:** Regularly inspect your garden and your home for signs of termite infestation. The most effective way to prevent and control termites is early detection.

6. **Professional Help:** If the infestation becomes large or difficult to handle, you may need to enlist the help of a professional pest control service. They have the tools and knowledge to deal with termite infestations effectively.

Remember that it's best to prevent termite infestations in the first place by keeping your garden clean and free of excess wood debris and regularly inspecting for signs of termites. If you catch the problem early, it can be much easier to deal with.",self_generate
How do I grow tomato?,2024-11-05T01:33:46.460800,"Chicken dung, seaweed emulsion, and bone meal are all natural substances often used as fertilizer to enrich soil and enhance plant growth. Chicken dung is high in nitrogen, while bone meal is rich in phosphorus and calcium, crucial for plant development. Seaweed emulsion supports plant health with a variety of micronutrients. Together, they can provide a balanced fertilization solution for various types of plants. It is suggested to trim off any excess or unwanted parts of plants for their optimal growth.",database
What plants can I grow under low light?,2024-11-05T01:36:32.827854,"Mint and basil can grow in conditions with less light but to thrive, most edible plants ideally require 4-6 hours of direct sunlight per day.",database
How to deal with nematode?,2024-11-05T02:10:02.675877,"Chop raw broccoli or cabbage and incorporate them into the soil. Additionally, utilize Crucifer extract, made from the same chopped vegetables, by adding it to the soil. Make sure to water as per your usual routine. This process may improve the soil health by introducing beneficial plant nutrients.",database
How to grow tomato?,2024-11-05T02:10:26.564678,"These are organic materials often used in gardening for soil enhancement and plant growth. Chicken dung is rich in nitrogen, bone meal provides phosphorous, and seaweed emulsion offers trace minerals and plant hormones, all essential in healthy plant development. They help achieve improved soil texture, nutrient absorption, and crop yield. Avoid excessive use as it might harm the plants.",database
My vegetables have been attacked by armyworm. What should I do?,2024-11-05T04:41:02.522657,"*Disclaimer: The following response may not be accurate as your question was not found in the verified database.*

Armyworms can indeed cause significant damage to your vegetables. Here are several steps you can take to address this issue:

1. **Hand-picking**: In case of a mild infestation, you might be able to control armyworms by simply removing them by hand from your plants and discarding them.

2. **Biological controls**: Birds, beneficial insects including beetles, wasps, spiders, and even certain types of bacteria and fungi are natural predators of armyworms. Attracting these to your garden might help. Bacillus thuringiensis (Bt) is a bacteria that infects and kills armyworm larvae. It's safe to use on organic farms and gardens.

3. **Chemical Controls**: If the infestation is severe, you may need to use chemical insecticides. Always read the label and follow all directions and safety precautions. Insecticides containing Spinosad, chlorantraniliprole, or indoxacarb can be effective.

4. **Cultural Controls**: Rotate your crops and plow your garden at the end of the season to destroy armyworm pupae in the soil. Also, regular monitoring of the garden could help to catch the infestation at an early stage.

5. **Trap Crops**: Growing armyworms' favorite crops like corn and bean on the outskirts of your main crop to distract them can be helpful.

Remember, it's important to correctly identify the pest before taking any steps for removal.
Always be sure to follow environmental guidelines in your area before applying any form of pest control.",self_generate
How to control aphids?,2024-11-06T02:02:38.340110,"To deter pests, create a mixture of 1L water, 1 teaspoon vegetable oil (to obstruct breathing holes), and 1 teaspoon dishwashing liquid (to dissolve waxy covering). Combine ingredients thoroughly and spray onto plants. If necessary, remove insects and affected plant parts then treat area with organic pesticides. Use organic chili water or diluted soap water as alternative methods. Employ a specialized insect net for finer bugs. Frequent sun exposure combined with regular neem oil application can also help. Lastly, white summer oil can be an optional treatment.",database
How to grow basil?,2024-11-06T02:36:09.502483,"This plant requires semi-shade and moderate water. It should receive 6 hours of bright light daily, excluding afternoon sunlight. Initiate growth by letting it root in water, changing the water daily. Once significant healthy roots are visible, it should be transferred to a pot with a potting mix.",database
"how much watering  is required for basil plant
",2024-11-06T03:30:30.603710,"*Disclaimer: The following response may not be accurate as your question was not found in the verified database.*

Basil plants typically need about 1 to 1.5 inches of water each week. It's best to water them thoroughly less often, as opposed to a little bit daily. Also, aim to water them in the morning so that the water can evaporate during the day, helping to prevent fungal diseases. Ensure that the pot or ground drains well, as basil does not like ""wet feet"" or being waterlogged. It's better for basil to be a bit too dry than too wet. Always make sure to check the top inch of soil before watering again - if it's dry, your basil is ready to be watered.",self_generate
how to provent plant to be sick,2024-11-06T06:07:59.520021,"*Disclaimer: The following response may not be accurate as your question was not found in the verified database.*

Of course, I'd be happy to help. Here are some tips on how you can prevent your plants from getting sick:

1. Regular Inspection: Always keep a close eye on your plants. Regular inspection is key to spotting signs of disease early, such as spotting, wilting, or discoloration before it's too late.

2. Watering: Overwatering and underwatering can both lead to plant illness. Make sure you're giving your plants the proper amount of water according to their specific needs. 

3. Proper Nutrition: Just like us, plants need the right balance of nutrients to thrive. Find out what nutrients your specific plants need and make sure they're getting them, whether through soil or fertilizers.

4. Sunlight: Different plants have different sunlight needs. Some need a lot of sun, while others do well in the shade. Make sure you're giving your plants the right amount of light.

5. Soil Quality: Plants need good, quality soil to grow strong and healthy. Well-drained soil rich in organic matter is typically a good choice.

6. Proper Spacing: Overcrowding can expose your plants to fungus and other diseases. Make sure your plants have the space they need to grow properly.

7. Check for Pests: Pests can quickly damage plants. Check regularly for signs of insect damage and treat accordingly.

8. Quarantine New Plants: If you buy a new plant, keep it separate from your other plants for a week or two to make sure it's not carrying any diseases. 

9. Prune Regularly: Pruning helps maintain the health of your plants. Remove any dead or sickly-looking branches or leaves to prevent the potential spread of disease.

10. Clean Gardening Tools: After using them in an affected plant, make sure to clean your tools. This will help prevent the spread of any potential disease. 

Remember, prevention is the best way to keep plant diseases at bay. However, if your plant gets sick, try to diagnose the problem as soon as possible and treat it accordingly.",self_generate
"why is my plant wilted?
",2024-11-06T06:13:49.812408,"Ensuring the appropriate water level for your plant is essential. Overwatering can harm it. Therefore, maintain a balance to support its healthy growth.",database
hy is my lettuce wilted although I water regularly?',2024-11-06T06:14:38.083670,"*Disclaimer: The following response may not be accurate as your question was not found in the verified database.*

Wilted lettuce, even with regular watering, could be due to a number of reasons:

1. Overwatering: Lettuce requires consistently moist soil, but too much water can lead to root problems. Overwatering can suffocate the roots and cause them to rot, which eventually leads to wilting.

2. Improper Lighting: While lettuce does well in a variety of light conditions, too much direct sunlight can cause the plant to wilt. Extreme heat can also lead to wilting.

3. Nutrient Deficiency: Lack of certain nutrients, like nitrogen, phosphorus, or potassium, can result in weak or wilted lettuce plants.

4. Disease or Pests: Certain fungi, bacteria, or pests can also cause lettuce leaves to wilt. Signs of disease may include spots, change in leaf color or abnormal growth patterns.

5. Incorrect Temperature: Lettuce prefers cooler temperatures. If it's too hot, especially for prolonged periods, the lettuce can wilt and eventually bolt, or go to seed prematurely.

To solve the issue, adjust your watering schedule and ensure the plants are getting adequate light but not too much direct harsh sunlight. Consider testing your soil for nutrient levels and make sure the lettuce is planted in a location with good drainage. If diseases or pests are spotted, treat them immediately with the appropriate remedy. Lastly, during hotter months, provide the plants with some shade or consider growing heat-tolerant varieties.",self_generate
why is my lettuce wilted although I water regularly?',2024-11-06T06:15:07.466766,"*Disclaimer: The following response may not be accurate as your question was not found in the verified database.*

Wilted lettuce, despite regular watering, could be due to several factors:

1. Overwatering: Although lettuce needs frequent watering, too much of it can cause the roots to become waterlogged and oxygen-starved, leading to wilted leaves.

2. Underwatering: On the other hand, lettuce's shallow roots can dry out quickly. If the watering is not sufficient, the plant will wilt.

3. Heat and sunlight: Lettuce is a cool-weather crop and generally don't do well in high heat or direct sunlight. Extended exposure can cause the plant to wilt and even bolt, or prematurely go to seed.

4. Diseases: Certain soil-borne diseases or pests can also cause wilting. For example, Fusarium wilt or root-knot nematodes can lead to wilted and yellow leaves.

5. Soil quality: Poor soil quality or nutrition can inhibit the ability of lettuce's roots to take up water and nutrients, leading to wilting. 

6. Transplant shock: if the lettuce was recently transplanted, it might go through a phase of shock that can cause wilting.

Ensure to troubleshoot these possible causes to rectify the problem. It may help to amend the soil with organic materials, use mulch to conserve moisture, provide a shade cloth during hot weather, and ensure adequate but not excessive watering.",self_generate
why is my lettuce wilted although I water regularly?',2024-11-06T06:16:13.147717,"*Disclaimer: The following response may not be accurate as your question was not found in the verified database.*

Wilted lettuce, even with regular watering, can be due to a few reasons:

1. Overwatering: While it's important to regularly water your lettuce, a common mistake many gardeners make is overwatering. Lettuce roots need oxygen as well as water, and over-saturating the soil can drown the roots and cause wilt.

2. Wrong Watering Time: Watering should ideally be done in cooler parts of the day (early morning or late evening). If watered in the heat, the plant may not uptake water efficiently and could appear wilted.

3. Temperature Stress: Lettuce prefers cooler temperatures. If the weather is hot, lettuce plants often wilt, regardless of how much you water them. 

4. Soil Quality: Poor soil structure or lack of nutrients can also lead to wilted lettuce. Lettuce prefers a well-drained soil rich in organic matter.

5. Disease or Pests: Fungal diseases or pests can also lead to wilting. Investigate for signs of pests or disease which could be damaging the plant.

Therefore, to prevent the lettuce from wilting, ensure the plant is watered properly but not overwatered, maintain good soil quality, and protect it from extreme temperatures. Also, regularly check for signs of pests or diseases.",self_generate
why is my lettuce wilted although I water regularly?,2024-11-06T06:17:09.272447,"*Disclaimer: The following response may not be accurate as your question was not found in the verified database.*

Lettuce can wilt for several reasons beyond just water supply:

1. Overwatering: While it may seem counterintuitive, overwatering can cause lettuce to wilt. This is because the roots need both water and oxygen to survive. If they are water-logged, they can't breathe, which can lead to rot and wilting.

2. Temperature: Lettuce is a cool-weather crop and can start to wilt if the temperature is too hot. Heat can cause the water in the leaves to evaporate faster than the roots can absorb more, causing the plant to wilt.

3. Light Exposure: It's possible that your lettuce is getting too much direct sunlight and is scorching or wilting as a result.

4. Pests or Disease: Certain pests or disease could be attacking your lettuce, sucking the juice out of the leaves causing them to wilt. 

5. Soil Quality: Your soil might not have the necessary nutrients for lettuce to grow properly. Supply the soil with organic matter or compost to help improve its quality.

6. Transplant Shock: If you recently transplanted your lettuce, it could be going through a bit of shock. This can also cause wilting.

Examine your lettuce and its overall environment to see if any of these factors could be causing the wilting. Then, adjust your care as needed, whether that means changing your watering habits, moving the plant to a cooler area, or treating for pests and diseases.",self_generate
How to prevent fungi on my plant?,2024-11-06T06:17:43.540235,"*Disclaimer: The following response may not be accurate as your question was not found in the verified database.*

Sure, I'd be glad to help. Here's what you can do to prevent fungi on your plants: 

1. Water Properly: Overwatering can create a damp environment that fungi love. Try to water plants at the base to keep foliage dry and water in the morning so that any splash on the leaves can dry during the day.

2. Use Fungus-Resistant Varieties: Some plants are bred to be resistant to certain types of fungus. 

3. Air Circulation: Proper air circulation can help control the humidity and temperature that fungi need to grow. Make sure plants aren't overcrowded and if they're in a greenhouse, use a fan to get the air moving.

4. Clean Tools: Always clean your gardening tools to prevent the spread of fungus. Also, remove and discard any infected plants or plant parts immediately.

5. Use Organic or Synthetic Fungicides: There are many on the market that can be applied to the leaves and stems of plants. Always follow the included instructions for the best results.

6. Proper Soil Mix: Using the right type of soil can also help prevent fungal diseases. Some plants do better in gravel or sand-based mixtures which dry out faster than heavier clay soils.

7. Crop Rotation: If you are dealing with a fungal issue in your vegetable garden, try to rotate your crops next year. This helps to break the life cycle of common plant diseases.

Remember, healthy plants are less likely to develop fungal diseases, so the best defense is to keep your garden in the best possible condition. Always remove and discard diseased plants and routinely check your garden to ensure early detection of any possible fungal growth.",self_generate
why did my kang kong die even though i water everyday?,2024-11-06T06:18:42.186889,"*Disclaimer: The following response may not be accurate as your question was not found in the verified database.*

Watering your kang kong every day might actually be the problem. Overwatering can lead to root rot, which eventually leads to plant death. Kang kong, also known as water spinach, requires moist, well-draining soil, but it doesn't handle saturated or waterlogged soil well. 

Another possible reason could be the lighting conditions. Kang kong is a tropical plant that loves plenty of sunlight. If it's growing in too much shade, this could negatively affect its health. 

Pests and diseases could also be a factor. These include leaf miners, aphids, and fungal diseases. If one of these infests your kang kong, it could quickly lead to the plant's death.

It could also be related to nutrient deficiency. Kang kong requires a nutrient-rich environment to grow. Regular fertilization with a balanced fertilizer can ensure the plant is getting what it needs.

Lastly, consider the temperature and climate. Kang kong prefers hot temperatures and typically does not do well in cold weather.

Overall, it's important to provide not just consistent watering, but also appropriate light, temperature, and nutrient conditions. If any pests are seen, deal with them promptly. By addressing these potential issues, you will hopefully have better luck with your Kang kong in future.",self_generate
How to cure my plant with fungi infested?,2024-11-06T06:21:42.477899,"Fungicides, such as neem, are used to control fungal diseases in crops. Another common, eco-friendly method involves sterilizing the soil with sunlight. This process, known as solarization, helps kill fungi, pests, and weeds. Furthermore, a solution of milk and water can be sprayed on plants to help ward off fungi. Each method has its unique advantages and can contribute significantly to maintaining healthy crops and plants.",database
What are the steps for gardening?,2024-11-06T06:26:31.545674,"To cultivate a fertile soil bed, it's crucial to use loamy soil and raise the bed. Rotate long beans which help fix nitrogen in the soil. Be aware of the location's conditions including the amount of sunlight and wind, and the watering schedule to ensure optimal growth.",database
